id,worker_id,event_type,effective_date,from_position_id,to_position_id,from_org_id,to_org_id,details
hist_7001,wrk_1001,HIRING,2020-03-15,,,pos_2001,,org_3001,Hired as Software Engineer II
hist_7002,wrk_1002,HIRING,2019-07-01,,,pos_2002,,org_3001,Hired as Engineering Manager
hist_7003,wrk_1003,HIRING,2021-01-10,,,pos_2003,,org_3002,Hired as HR Specialist
hist_7004,wrk_1003,TERMINATION,2023-12-31,pos_2003,,org_3002,,Voluntary resignation
hist_7005,wrk_1004,HIRING,2022-05-20,,,pos_2004,,org_3004,Hired as Data Analyst (contractor)
hist_7006,wrk_1005,HIRING,2023-09-01,,,pos_2005,,org_3003,Hired as Finance Associate
hist_7007,wrk_1005,PROMOTION,2024-03-01,pos_2005,pos_2005,org_3003,org_3003,Promoted with salary increase
